{
  "graph_id": "CDNA-001-SPACE-GRAPH-001",
  "case_id": "CDNA-001",
  "version": "0.1.0",
  "semantics": {
    "projective": "Space of proposed causal structure: hypotheses, possible mediators, predictions and planned interventions. Nothing here is a material fact merely because it is coherent.",
    "bardo": "Transition space for unresolved causal states. Competing explanations, partial support, conflicts and decisive gates are preserved here until evidence materializes, rejects or supersedes them.",
    "material": "Evidence-backed observations and interventions. Entry into this space requires provenance; causal mechanism and observed total effect remain distinct."
  },
  "nodes": [
    {
      "id": "P_GAP001",
      "label": "Find the adult male PH mediator between rs1421085 T>C and Irx3 increase",
      "space": "projective",
      "kind": "question",
      "state": "proposed",
      "hypothesis_refs": ["H1", "H2a", "H3", "H4", "H5", "H6", "H7", "H8", "H9", "H10"],
      "evidence_refs": [],
      "notes": "Projective representation of GAP-001; it is generated by two material boundary observations but is not itself evidence."
    },
    {
      "id": "P_H1_ARID5B",
      "label": "ARID5B reuse in adult posterior hypothalamus",
      "space": "projective",
      "kind": "hypothesis",
      "state": "proposed",
      "hypothesis_refs": ["H1"],
      "evidence_refs": []
    },
    {
      "id": "P_H2_CUX1",
      "label": "CUX1 exact-site or combinatorial interpretation",
      "space": "projective",
      "kind": "hypothesis",
      "state": "proposed",
      "hypothesis_refs": ["H2a"],
      "evidence_refs": []
    },
    {
      "id": "P_H3_ACCESS",
      "label": "Allele-dependent local chromatin accessibility",
      "space": "projective",
      "kind": "hypothesis",
      "state": "proposed",
      "hypothesis_refs": ["H3"],
      "evidence_refs": []
    },
    {
      "id": "P_H4_CONTACT",
      "label": "Allele-dependent enhancer-to-Irx3 3D contact",
      "space": "projective",
      "kind": "hypothesis",
      "state": "proposed",
      "hypothesis_refs": ["H4"],
      "evidence_refs": []
    },
    {
      "id": "P_H6_COMPOSITION",
      "label": "Cell composition or state shift rather than per-cell induction",
      "space": "projective",
      "kind": "hypothesis",
      "state": "proposed",
      "hypothesis_refs": ["H6"],
      "evidence_refs": []
    },
    {
      "id": "P_H7_SEX",
      "label": "Sex-dependent regulatory context modifies the allele effect",
      "space": "projective",
      "kind": "hypothesis",
      "state": "proposed",
      "hypothesis_refs": ["H7"],
      "evidence_refs": []
    },
    {
      "id": "P_H8_GRAMMAR",
      "label": "Point-substitution-specific intact enhancer grammar",
      "space": "projective",
      "kind": "hypothesis",
      "state": "proposed",
      "hypothesis_refs": ["H8"],
      "evidence_refs": []
    },
    {
      "id": "P_H9_TIME",
      "label": "Temporal or developmental gating of the same locus",
      "space": "projective",
      "kind": "hypothesis",
      "state": "proposed",
      "hypothesis_refs": ["H9"],
      "evidence_refs": []
    },
    {
      "id": "P_DECISIVE_EXPERIMENT",
      "label": "Allele x sex x cell-state regulatory experiment",
      "space": "projective",
      "kind": "experiment",
      "state": "planned",
      "hypothesis_refs": ["H1", "H2a", "H3", "H4", "H6", "H7", "H8", "H9", "H10"],
      "evidence_refs": [],
      "notes": "Measure Irx3 RNA, accessibility, ARID5B/CUX1 occupancy and enhancer-to-Irx3 contact in matched exact-allele material, then perturb/rescue the winning mediator."
    },

    {
      "id": "B_H1_ARID5B",
      "label": "ARID5B is cell-feasible but adult-PH occupancy is unresolved",
      "space": "bardo",
      "kind": "mediator",
      "state": "competing",
      "hypothesis_refs": ["H1"],
      "evidence_refs": ["results/gap001-gse146692/report.md", "results/gap001-cux1-presence/report.md", "PMID:26287746", "PMID:34290091"],
      "resolution": "open",
      "notes": "Adipocyte mechanism is causal elsewhere; direct transfer into adult PH is forbidden without native-context evidence."
    },
    {
      "id": "B_H2_CUX1",
      "label": "CUX1 exact-site state is feasible but target program is unresolved",
      "space": "bardo",
      "kind": "mediator",
      "state": "competing",
      "hypothesis_refs": ["H2a"],
      "evidence_refs": ["results/gap001-cux1-presence/report.md", "research/GAP-001-evidence-pass-02-cux1-switch.md"],
      "resolution": "open"
    },
    {
      "id": "B_H3_ACCESS",
      "label": "Allele-specific chromatin accessibility state",
      "space": "bardo",
      "kind": "cell_state",
      "state": "unresolved",
      "hypothesis_refs": ["H3", "H8"],
      "evidence_refs": ["research/GAP-001-evidence-pass-04-adult-PH-regulatory-gap.md"],
      "resolution": "open"
    },
    {
      "id": "B_H4_CONTACT",
      "label": "Allele-specific enhancer-to-Irx3 contact state",
      "space": "bardo",
      "kind": "cell_state",
      "state": "unresolved",
      "hypothesis_refs": ["H4", "H8", "H10"],
      "evidence_refs": ["PMID:34290091", "research/GAP-001-evidence-pass-04-adult-PH-regulatory-gap.md"],
      "resolution": "open"
    },
    {
      "id": "B_H6_COMPOSITION",
      "label": "Per-cell induction versus composition shift remains unresolved",
      "space": "bardo",
      "kind": "cell_state",
      "state": "unresolved",
      "hypothesis_refs": ["H6"],
      "evidence_refs": ["results/gap001-strict-cell-context/report.md"],
      "resolution": "open",
      "notes": "Raw marker screens reached insufficient resolution and are preserved as a method boundary."
    },
    {
      "id": "B_H7_SEX",
      "label": "Male-specific response modifier is present but molecular identity is unresolved",
      "space": "bardo",
      "kind": "cell_state",
      "state": "unresolved",
      "hypothesis_refs": ["H7"],
      "evidence_refs": ["PMID:40835181", "cases/CDNA-001-GAP-001.status.json"],
      "resolution": "open"
    },
    {
      "id": "B_H8_GRAMMAR",
      "label": "Intact enhancer grammar may encode multiple allele-sensitive interpreters",
      "space": "bardo",
      "kind": "mediator",
      "state": "competing",
      "hypothesis_refs": ["H8"],
      "evidence_refs": ["research/GAP-001-evidence-pass-02-cux1-switch.md", "results/gap001-motif-candidates/report.md"],
      "resolution": "open"
    },
    {
      "id": "B_H9_TIME",
      "label": "Developmental locus state may gate the adult response",
      "space": "bardo",
      "kind": "cell_state",
      "state": "competing",
      "hypothesis_refs": ["H9"],
      "evidence_refs": ["research/GAP-001-evidence-pass-03-developmental-gating.md", "PMID:34290091"],
      "resolution": "open"
    },
    {
      "id": "B_INTEGRATION_GATE",
      "label": "GAP-001 decisive mediator gate",
      "space": "bardo",
      "kind": "gate",
      "state": "unresolved",
      "hypothesis_refs": ["H1", "H2a", "H3", "H4", "H6", "H7", "H8", "H9", "H10"],
      "evidence_refs": ["experiments/GAP-001-decisive-regulatory-matrix.md"],
      "resolution": "open",
      "notes": "This gate can materialize a mediator only after exact-allele native-context measurement plus perturbation/rescue."
    },

    {
      "id": "M_RS1421085_EDIT",
      "label": "Engineered rs1421085 obesity-associated allele in mouse",
      "space": "material",
      "kind": "variant",
      "state": "observed",
      "context": {
        "species": "Mus musculus",
        "tissue": "organism / brain",
        "cell_type": null,
        "sex": "male and female",
        "developmental_state": "adult",
        "environment": "in vivo"
      },
      "evidence_refs": ["CDNA-001-E04", "PMID:40835181"]
    },
    {
      "id": "M_IRX3_UP",
      "label": "Genotype-dependent Irx3 increase in posterior hypothalamus",
      "space": "material",
      "kind": "measurement",
      "state": "observed",
      "context": {
        "species": "Mus musculus",
        "tissue": "posterior hypothalamus",
        "cell_type": null,
        "sex": "notable dose response in males",
        "developmental_state": "adult",
        "environment": "in vivo"
      },
      "evidence_refs": ["CDNA-001-E04", "PMID:40835181"],
      "notes": "This is a material downstream boundary for GAP-001, not evidence that any specific mediator is established."
    },
    {
      "id": "M_PH_ACTIVITY_DOWN",
      "label": "IRX3-positive posterior-hypothalamic neuronal activity decreases",
      "space": "material",
      "kind": "circuit_state",
      "state": "perturbed",
      "context": {
        "species": "Mus musculus",
        "tissue": "posterior hypothalamus",
        "cell_type": "IRX3-positive neuron",
        "sex": null,
        "developmental_state": "adult",
        "environment": "in vivo"
      },
      "evidence_refs": ["CDNA-001-E05", "PMID:40835181"]
    },
    {
      "id": "M_FOOD_UP",
      "label": "Food intake increases after PH IRX3-circuit inhibition/dysregulation",
      "space": "material",
      "kind": "phenotype",
      "state": "perturbed",
      "context": {
        "species": "Mus musculus",
        "tissue": "organism",
        "cell_type": null,
        "sex": null,
        "developmental_state": "adult",
        "environment": "in vivo"
      },
      "evidence_refs": ["CDNA-001-E06", "PMID:40835181"]
    },
    {
      "id": "M_WEIGHT_UP",
      "label": "Body weight increases",
      "space": "material",
      "kind": "phenotype",
      "state": "observed",
      "context": {
        "species": "Mus musculus",
        "tissue": "organism",
        "cell_type": null,
        "sex": null,
        "developmental_state": "adult",
        "environment": "in vivo"
      },
      "evidence_refs": ["CDNA-001-E06", "PMID:40835181"]
    }
  ],
  "edges": [